{"$schema":"https://json-schema.org/draft/2020-12/schema","$defs":{"ActionEntry":{"additionalProperties":false,"properties":{"repo":{"title":"Repo","type":"string"},"type":{"enum":["add_labels","comment"],"title":"Type","type":"string"},"target":{"title":"Target","type":"integer"},"detail":{"title":"Detail"},"status":{"enum":["planned","applied","skipped","failed"],"title":"Status","type":"string"},"reason":{"anyOf":[{"type":"string"},{"type":"null"}],"default":null,"title":"Reason"}},"required":["repo","type","target","detail","status","reason"],"title":"ActionEntry","type":"object"},"Activity12w":{"additionalProperties":false,"properties":{"weeks":{"items":{"type":"string"},"title":"Weeks","type":"array"},"opened":{"items":{"type":"integer"},"title":"Opened","type":"array"},"closed":{"items":{"type":"integer"},"title":"Closed","type":"array"}},"required":["weeks","opened","closed"],"title":"Activity12w","type":"object"},"AppliedInfo":{"additionalProperties":false,"properties":{"labels":{"items":{"type":"string"},"title":"Labels","type":"array"},"commented":{"default":false,"title":"Commented","type":"boolean"}},"required":["labels","commented"],"title":"AppliedInfo","type":"object"},"ChangelogBlock":{"additionalProperties":false,"properties":{"base_ref":{"anyOf":[{"type":"string"},{"type":"null"}],"title":"Base Ref"},"base_date":{"title":"Base Date","type":"string"},"source":{"enum":["pull_requests","commits"],"title":"Source","type":"string"},"item_count":{"minimum":0,"title":"Item Count","type":"integer"},"suggested_version":{"anyOf":[{"type":"string"},{"type":"null"}],"title":"Suggested Version"},"markdown":{"title":"Markdown","type":"string"},"narrative_source":{"enum":["llm","template"],"title":"Narrative Source","type":"string"},"model":{"anyOf":[{"type":"string"},{"type":"null"}],"default":null,"title":"Model"},"generated_at":{"title":"Generated At","type":"string"},"cached":{"title":"Cached","type":"boolean"}},"required":["base_ref","base_date","source","item_count","suggested_version","markdown","narrative_source","model","generated_at","cached"],"title":"ChangelogBlock","type":"object"},"Counts":{"additionalProperties":false,"properties":{"open_issues":{"minimum":0,"title":"Open Issues","type":"integer"},"untriaged":{"minimum":0,"title":"Untriaged","type":"integer"},"untriaged_over_7d":{"minimum":0,"title":"Untriaged Over 7D","type":"integer"},"open_prs":{"minimum":0,"title":"Open Prs","type":"integer"},"stale_prs":{"minimum":0,"title":"Stale Prs","type":"integer"},"no_response_count":{"minimum":0,"title":"No Response Count","type":"integer"}},"required":["open_issues","untriaged","untriaged_over_7d","open_prs","stale_prs","no_response_count"],"title":"Counts","type":"object"},"DuplicateRef":{"additionalProperties":false,"properties":{"number":{"title":"Number","type":"integer"},"url":{"format":"uri","maxLength":2083,"minLength":1,"title":"Url","type":"string"},"title":{"title":"Title","type":"string"},"similarity":{"maximum":1,"minimum":0,"title":"Similarity","type":"number"},"state":{"enum":["open","closed"],"title":"State","type":"string"}},"required":["number","url","title","similarity","state"],"title":"DuplicateRef","type":"object"},"FixLoopInfo":{"additionalProperties":false,"description":"How the fix proposer's agent loop went (§6.1).","properties":{"steps":{"minimum":0,"title":"Steps","type":"integer"},"stop_reason":{"title":"Stop Reason","type":"string"},"usd":{"minimum":0,"title":"Usd","type":"number"},"tools_called":{"items":{"type":"string"},"title":"Tools Called","type":"array"}},"required":["steps","stop_reason","usd","tools_called"],"title":"FixLoopInfo","type":"object"},"FixProposalEntry":{"additionalProperties":false,"description":"One fix-proposer result for one issue (§6.1). ``id`` is what a human approves\n(``--approve-fix <id>``); it's bound to the exact ``diff``.","properties":{"id":{"pattern":"^[0-9a-f]{12}$","title":"Id","type":"string"},"issue_number":{"title":"Issue Number","type":"integer"},"issue_url":{"format":"uri","maxLength":2083,"minLength":1,"title":"Issue Url","type":"string"},"issue_title":{"title":"Issue Title","type":"string"},"status":{"enum":["proposed","no_fix","stopped","pr_opened","approval_blocked","failed"],"title":"Status","type":"string"},"reason":{"anyOf":[{"type":"string"},{"type":"null"}],"default":null,"title":"Reason"},"summary":{"anyOf":[{"type":"string"},{"type":"null"}],"default":null,"title":"Summary"},"rationale":{"anyOf":[{"type":"string"},{"type":"null"}],"default":null,"title":"Rationale"},"narrative_source":{"anyOf":[{"enum":["llm","template"],"type":"string"},{"type":"null"}],"default":null,"title":"Narrative Source"},"diff":{"anyOf":[{"type":"string"},{"type":"null"}],"default":null,"title":"Diff"},"files_changed":{"items":{"type":"string"},"title":"Files Changed","type":"array"},"lines_added":{"default":0,"minimum":0,"title":"Lines Added","type":"integer"},"lines_removed":{"default":0,"minimum":0,"title":"Lines Removed","type":"integer"},"pr_url":{"anyOf":[{"format":"uri","maxLength":2083,"minLength":1,"type":"string"},{"type":"null"}],"default":null,"title":"Pr Url"},"loop":{"$ref":"#/$defs/FixLoopInfo"},"model":{"anyOf":[{"type":"string"},{"type":"null"}],"default":null,"title":"Model"},"proposed_at":{"title":"Proposed At","type":"string"}},"required":["id","issue_number","issue_url","issue_title","status","reason","summary","rationale","narrative_source","diff","files_changed","lines_added","lines_removed","pr_url","loop","model","proposed_at"],"title":"FixProposalEntry","type":"object"},"HealthBlock":{"additionalProperties":false,"properties":{"score":{"maximum":100,"minimum":0,"title":"Score","type":"integer"},"grade":{"enum":["A","B","C","D","F"],"title":"Grade","type":"string"},"breakdown":{"items":{"$ref":"#/$defs/HealthBreakdown"},"title":"Breakdown","type":"array"}},"required":["score","grade","breakdown"],"title":"HealthBlock","type":"object"},"HealthBreakdown":{"additionalProperties":false,"properties":{"reason":{"title":"Reason","type":"string"},"points":{"title":"Points","type":"integer"}},"required":["reason","points"],"title":"HealthBreakdown","type":"object"},"KeyStat":{"additionalProperties":false,"properties":{"label":{"title":"Label","type":"string"},"value":{"anyOf":[{"type":"number"},{"type":"null"}],"title":"Value"},"format":{"enum":["currency_compact","currency","percent","percent_signed","pp_signed","count","count_signed","count_signed_thousands","decimal1","days","ratio"],"title":"Format","type":"string"},"delta":{"anyOf":[{"type":"number"},{"type":"null"}],"default":null,"title":"Delta"},"delta_format":{"anyOf":[{"enum":["currency_compact","currency","percent","percent_signed","pp_signed","count","count_signed","count_signed_thousands","decimal1","days","ratio"],"type":"string"},{"type":"null"}],"default":null,"title":"Delta Format"},"good_direction":{"default":"neutral","enum":["up","down","neutral"],"title":"Good Direction","type":"string"}},"required":["label","value","format","delta","delta_format","good_direction"],"title":"KeyStat","type":"object"},"ModelUsage":{"additionalProperties":false,"properties":{"fast":{"$ref":"#/$defs/TierUsage"},"smart":{"$ref":"#/$defs/TierUsage"}},"required":["fast","smart"],"title":"ModelUsage","type":"object"},"RepoEntry":{"additionalProperties":false,"properties":{"full_name":{"title":"Full Name","type":"string"},"url":{"format":"uri","maxLength":2083,"minLength":1,"title":"Url","type":"string"},"role":{"enum":["own","sandbox","public_demo"],"title":"Role","type":"string"},"allow_apply":{"title":"Allow Apply","type":"boolean"},"partial":{"default":false,"title":"Partial","type":"boolean"},"health":{"$ref":"#/$defs/HealthBlock"},"counts":{"$ref":"#/$defs/Counts"},"median_first_response_hours":{"anyOf":[{"type":"number"},{"type":"null"}],"default":null,"title":"Median First Response Hours"},"ci_default_branch":{"enum":["success","failure","pending","none"],"title":"Ci Default Branch","type":"string"},"days_since_release":{"anyOf":[{"type":"integer"},{"type":"null"}],"default":null,"title":"Days Since Release"},"activity_12w":{"$ref":"#/$defs/Activity12w"},"triage":{"items":{"$ref":"#/$defs/TriageItem"},"title":"Triage","type":"array"},"stale_prs":{"items":{"$ref":"#/$defs/StalePRItem"},"title":"Stale Prs","type":"array"},"changelog":{"$ref":"#/$defs/ChangelogBlock"},"fix_proposals":{"items":{"$ref":"#/$defs/FixProposalEntry"},"title":"Fix Proposals","type":"array"}},"required":["full_name","url","role","allow_apply","partial","health","counts","median_first_response_hours","ci_default_branch","days_since_release","activity_12w","triage","stale_prs","changelog","fix_proposals"],"title":"RepoEntry","type":"object"},"RepoMaintMeta":{"additionalProperties":false,"description":"The repo_maint-specific extension of the shared meta block (§6).","properties":{"agent":{"title":"Agent","type":"string"},"schema_version":{"pattern":"^\\d+\\.\\d+\\.\\d+$","title":"Schema Version","type":"string"},"run_id":{"title":"Run Id","type":"string"},"started_at":{"title":"Started At","type":"string"},"finished_at":{"title":"Finished At","type":"string"},"status":{"enum":["ok","stale","failed"],"title":"Status","type":"string"},"data_changed":{"title":"Data Changed","type":"boolean"},"cost_usd":{"minimum":0,"title":"Cost Usd","type":"number"},"model_usage":{"$ref":"#/$defs/ModelUsage"},"sources":{"items":{"$ref":"#/$defs/Source"},"title":"Sources","type":"array"},"warnings":{"items":{"type":"string"},"title":"Warnings","type":"array"},"meta_schema_version":{"default":"1.1.0","pattern":"^\\d+\\.\\d+\\.\\d+$","title":"Meta Schema Version","type":"string"},"github_requests":{"default":0,"minimum":0,"title":"Github Requests","type":"integer"},"github_304s":{"default":0,"minimum":0,"title":"Github 304S","type":"integer"}},"required":["agent","schema_version","run_id","started_at","finished_at","status","data_changed","cost_usd","model_usage","sources","warnings","meta_schema_version","github_requests","github_304s"],"title":"RepoMaintMeta","type":"object"},"Source":{"additionalProperties":false,"description":"A dataset or page an agent pulled from, shown in the site's source list.","properties":{"name":{"title":"Name","type":"string"},"url":{"format":"uri","maxLength":2083,"minLength":1,"title":"Url","type":"string"},"retrieved_at":{"title":"Retrieved At","type":"string"}},"required":["name","url","retrieved_at"],"title":"Source","type":"object"},"StalePRItem":{"additionalProperties":false,"properties":{"number":{"title":"Number","type":"integer"},"title":{"title":"Title","type":"string"},"url":{"format":"uri","maxLength":2083,"minLength":1,"title":"Url","type":"string"},"author":{"title":"Author","type":"string"},"age_days":{"minimum":0,"title":"Age Days","type":"integer"},"last_activity_at":{"title":"Last Activity At","type":"string"},"review_state":{"enum":["none","review_requested","changes_requested","approved","commented"],"title":"Review State","type":"string"},"ci_state":{"enum":["success","failure","pending","none"],"title":"Ci State","type":"string"},"nudge":{"title":"Nudge","type":"string"}},"required":["number","title","url","author","age_days","last_activity_at","review_state","ci_state","nudge"],"title":"StalePRItem","type":"object"},"TierUsage":{"additionalProperties":false,"properties":{"input_tokens":{"default":0,"title":"Input Tokens","type":"integer"},"output_tokens":{"default":0,"title":"Output Tokens","type":"integer"}},"required":["input_tokens","output_tokens"],"title":"TierUsage","type":"object"},"TriageItem":{"additionalProperties":false,"properties":{"number":{"title":"Number","type":"integer"},"title":{"title":"Title","type":"string"},"url":{"format":"uri","maxLength":2083,"minLength":1,"title":"Url","type":"string"},"author":{"title":"Author","type":"string"},"created_at":{"title":"Created At","type":"string"},"classification":{"enum":["bug","feature","question","docs","chore","other"],"title":"Classification","type":"string"},"priority":{"enum":["p0","p1","p2","p3"],"title":"Priority","type":"string"},"confidence":{"enum":["low","medium","high"],"title":"Confidence","type":"string"},"suggested_labels":{"items":{"type":"string"},"title":"Suggested Labels","type":"array"},"missing_info":{"items":{"type":"string"},"title":"Missing Info","type":"array"},"summary":{"anyOf":[{"type":"string"},{"type":"null"}],"default":null,"title":"Summary"},"duplicates":{"items":{"$ref":"#/$defs/DuplicateRef"},"title":"Duplicates","type":"array"},"applied":{"$ref":"#/$defs/AppliedInfo"},"cached":{"default":false,"title":"Cached","type":"boolean"}},"required":["number","title","url","author","created_at","classification","priority","confidence","suggested_labels","missing_info","summary","duplicates","applied","cached"],"title":"TriageItem","type":"object"}},"additionalProperties":false,"description":"The full `latest.json` contract for this agent (§6).","properties":{"meta":{"$ref":"#/$defs/RepoMaintMeta"},"headline":{"title":"Headline","type":"string"},"key_stats":{"items":{"$ref":"#/$defs/KeyStat"},"maxItems":4,"title":"Key Stats","type":"array"},"mode":{"enum":["report","apply"],"title":"Mode","type":"string"},"repos":{"items":{"$ref":"#/$defs/RepoEntry"},"title":"Repos","type":"array"},"actions":{"items":{"$ref":"#/$defs/ActionEntry"},"title":"Actions","type":"array"}},"required":["meta","headline","key_stats","mode","repos","actions"],"title":"RepoMaintOutput","type":"object"}