{"meta":{"agent":"repo_maint","schema_version":"1.1.0","run_id":"2026-09-27T00-44-22Z-3341c6","started_at":"2026-09-27T00:44:22Z","finished_at":"2026-09-27T00:44:27Z","status":"ok","data_changed":false,"cost_usd":0.0,"model_usage":{"fast":{"input_tokens":0,"output_tokens":0},"smart":{"input_tokens":0,"output_tokens":0}},"sources":[{"name":"GitHub: Kghaffari26/repo-maintain-agent","url":"https://github.com/Kghaffari26/repo-maintain-agent","retrieved_at":"2026-09-27T00:44:27Z"}],"warnings":["Kghaffari26/agents-core: skipped this run (GET /repos/Kghaffari26/agents-core failed: GET https://api.github.com/repos/Kghaffari26/agents-core -> 403)","Kghaffari26/real-estate-agent: skipped this run (GET /repos/Kghaffari26/real-estate-agent failed: GET https://api.github.com/repos/Kghaffari26/real-estate-agent -> 403)","Kghaffari26/fed-agent: skipped this run (GET /repos/Kghaffari26/fed-agent failed: GET https://api.github.com/repos/Kghaffari26/fed-agent -> 403)","Kghaffari26/sam-agent: skipped this run (GET /repos/Kghaffari26/sam-agent failed: GET https://api.github.com/repos/Kghaffari26/sam-agent -> 403)","Kghaffari26/agents-hub: skipped this run (GET /repos/Kghaffari26/agents-hub failed: GET https://api.github.com/repos/Kghaffari26/agents-hub -> 403)"],"meta_schema_version":"1.1.0","github_requests":12,"github_304s":6},"headline":"1 repo watched (5 unreachable): 0 issues triaged, 0 untriaged, 0 stale PRs.","key_stats":[{"label":"Untriaged issues","value":0.0,"format":"count","delta":0.0,"delta_format":"count_signed","good_direction":"down"},{"label":"Avg health","value":94.0,"format":"count","delta":0.0,"delta_format":"count_signed","good_direction":"up"},{"label":"Stale PRs","value":0.0,"format":"count","delta":0.0,"delta_format":"count_signed","good_direction":"down"}],"mode":"report","repos":[{"full_name":"Kghaffari26/repo-maintain-agent","url":"https://github.com/Kghaffari26/repo-maintain-agent","role":"own","allow_apply":false,"partial":false,"health":{"score":94,"grade":"A","breakdown":[{"reason":"Missing LICENSE, CONTRIBUTING","points":-6}]},"counts":{"open_issues":0,"untriaged":0,"untriaged_over_7d":0,"open_prs":0,"stale_prs":0,"no_response_count":0},"median_first_response_hours":null,"ci_default_branch":"none","days_since_release":null,"activity_12w":{"weeks":["2026-W28","2026-W29","2026-W30","2026-W31","2026-W32","2026-W33","2026-W34","2026-W35","2026-W36","2026-W37","2026-W38","2026-W39"],"opened":[0,0,0,0,0,0,0,0,0,0,0,0],"closed":[0,0,0,0,0,0,0,0,0,0,0,0]},"triage":[],"stale_prs":[],"changelog":{"base_ref":null,"base_date":"2026-08-28","source":"commits","item_count":12,"suggested_version":null,"markdown":"## Unreleased\n\n### Added\n- Scaffold repo-maint agent with GitHub client and config (90d71bc)\n- Restructure for agents-core dependency, drop core/, py3.12, injectable gh.py (66e797d)\n- Add deterministic §5 pipeline: fetch, metrics, untriaged, duplicates, stale, health (7d89e89)\n- Add triage.py with label allowlisting, priority escalation, duplicate confirmation, caching (bd20ef8)\n- Add sanitize.py and actions.py implementing full §8 safety design (dd35844)\n- Add schema.py, state.py, and scripts/seed_sandbox.py (ac69d95)\n- Add §11 evals: 40-issue fixture set, injection resistance, changelog fidelity (cffc21f)\n- Add pipeline.py for end-to-end orchestration from fetch to publish (4120e23)\n- Add GitHub Actions workflow for repo-maint agent, cron and dispatch (57659d9)\n- Add README, CLAUDE.md, .env.example, and STATUS.md documentation (85a75af)\n- Wire in agents-core v0.1.0 for triage, changelog, and data-branch publish (4533103)\n\n### Other\n- Run real report-mode test against repos, $0.00 cost, 22 requests (d05411a)","narrative_source":"llm","model":"claude-sonnet-5","generated_at":"2026-09-27T00:42:17Z","cached":true},"fix_proposals":[]}],"actions":[]}